{
  "artifact": {
    "kind": "layout_proxy_scene",
    "path": "work/flat_planetary_gear_assembly/review/layout/layout_proxy.scene.json"
  },
  "checks": [
    {
      "check_id": "scene_primitives_present",
      "check_type": "label",
      "evidence": "9 layout proxy primitives generated.",
      "locked_fact_refs": [],
      "status": "passed"
    },
    {
      "check_id": "scene_locked_facts_carried",
      "check_type": "label",
      "evidence": "7 locked layout facts carried into scene.",
      "locked_fact_refs": [
        "separate_bodies_locked",
        "planet_radius_locked",
        "gear_axes_parallel_locked",
        "involute_teeth_locked",
        "no_tooth_overlap_locked",
        "module_locked_ring_mesh_locked",
        "premium_detail_non_mesh_locked"
      ],
      "status": "passed"
    }
  ],
  "extensions": {
    "generator": "tools/generate_layout_proxy.py"
  },
  "id": "flat_planetary_gear_assembly.layout_proxy_scene_report",
  "kind": "inspection_report",
  "limitations": [
    "This is a kernel-neutral layout proxy scene, not generated CAD geometry.",
    "Downstream CAD generation and geometry inspection are still required before proceed review."
  ],
  "proceed_recommendation": "ready_for_layout_generation",
  "repair_attempts": [],
  "schema_version": "0.8.0",
  "skipped_checks": [
    {
      "check_id": "check_planet_radius",
      "reason": "Kernel-neutral layout proxy scene generated; downstream CAD geometry inspection still required."
    },
    {
      "check_id": "check_ring_sun_coaxial",
      "reason": "Kernel-neutral layout proxy scene generated; downstream CAD geometry inspection still required."
    },
    {
      "check_id": "check_viewer_link",
      "reason": "Kernel-neutral layout proxy scene generated; downstream CAD geometry inspection still required."
    },
    {
      "check_id": "check_no_tooth_overlap",
      "reason": "Kernel-neutral layout proxy scene generated; downstream CAD geometry inspection still required."
    },
    {
      "check_id": "check_module_locked_ring_mesh",
      "reason": "Kernel-neutral layout proxy scene generated; downstream CAD geometry inspection still required."
    },
    {
      "check_id": "check_involute_ring_mesh",
      "reason": "Kernel-neutral layout proxy scene generated; downstream CAD geometry inspection still required."
    }
  ],
  "spec_id": "flat_planetary_gear_assembly",
  "status": "partial"
}
